{
  "proof_card_ref": "pc-0b47b131d406",
  "profile_ref": "PROFILE_OPENRAN_RIC",
  "verdict": "READY",
  "window_ref": "W-DEMO-case_01",
  "reason_code": [
    "CHECKS_PASSED",
    "RC_PRIVACY_PASS"
  ],
  "enforcement_path_ref": "EP-DEFAULT-01",
  "authority_scope_ref": "SCOPE-CPE-LOCAL",
  "validity_horizon_ref": "7DAYS",
  "validity_verdict": "VALID",
  "basis_ref": "BASIS-V1.4",
  "sample_count": 20,
  "p50": [
    {
      "name": "rtt_ms_p50",
      "value": 24.0,
      "unit": "auto"
    },
    {
      "name": "loss_pct_p50",
      "value": 0.15000000000000002,
      "unit": "auto"
    },
    {
      "name": "wifi_retry_pct_p50",
      "value": 1.3,
      "unit": "auto"
    }
  ],
  "p95": [
    {
      "name": "rtt_ms_p95",
      "value": 28.0,
      "unit": "auto"
    },
    {
      "name": "loss_pct_p95",
      "value": 0.2,
      "unit": "auto"
    },
    {
      "name": "wifi_retry_pct_p95",
      "value": 1.9,
      "unit": "auto"
    }
  ],
  "outcome_facet": [
    {
      "name": "rtt_ms_p95",
      "value": 28.0,
      "unit": "ms"
    },
    {
      "name": "loss_rate_p95",
      "value": 0.2,
      "unit": "%"
    },
    {
      "name": "phy_rate_p50",
      "value": 0,
      "unit": "Mbps"
    }
  ],
  "event_type": [],
  "evidence_bundle_ref": "bundle:W-DEMO-case_01",
  "manifest_ref": "MAN-DEMO-case_01",
  "attempt_id": "att-113b85130195",
  "enforcement_path_id": "EP-DEFAULT-01",
  "gate_ref": "GATE-DEFAULT-01",
  "evidence_grade": "DELIVERY_GRADE",
  "version_refs": {
    "policy_snapshot_ref": "POLICY@2026-02-10#1",
    "window_policy_id": "WP-001"
  },
  "missing_evidence_class": [],
  "upgrade_requirements_ref": null,
  "min": {
    "admission_verdict": "ADMIT",
    "admission_effect": "NONE",
    "privacy_check_verdict": "PASS",
    "egress_receipt_ref": null,
    "byuse_context_ref": null
  },
  "priv": {
    "privacy_policy_ref": "PRIV@v4",
    "purpose_ref": "PURP.NETWORK_OPERATION",
    "retention_ref": "RET.7D",
    "disclosure_scope_ref": "SCOPE.MIN",
    "redaction_profile_ref": null,
    "privacy_violation_flag": false,
    "privacy_violation_reason_code": []
  }
}